{
  "school": "UG",
  "major": "5302",
  "degree": "BA",
  "year": "2025",
  "Date": "5/14/2025",
  "Cat_yr_start": "2021",
  "Cat_yr": "2025",
  "blocks": [
    {
      "BlockType": "CORE",
      "BlockID": "RA000882",
      "Title": "University Core (Major courses may apply in core)",
      "Credits": 42,
      "rules": [
        {
          "rules": [
            {
              "label": "English Composition ",
              "id": "2-0-1-0",
              "courses": [
                {
                  "Subj": "ENG",
                  "Num": "1113"
                },
                {
                  "Subj": "ENG",
                  "Num": "1143"
                },
                {
                  "Subj": "ENG",
                  "Num": "1153"
                },
                {
                  "Subj": "ENG",
                  "Num": "1173"
                },
                {
                  "Subj": "ENG",
                  "Num": "1133",
                  "Hide": 1
                },
                {
                  "Subj": "@",
                  "Num": "@",
                  "With": {
                    "ATTRIBUTE": "ZCMP"
                  },
                  "Hide": 1
                }
              ],
              "reqType": "Credits",
              "reqCount": 3.0,
              "Conn": "Or"
            },
            {
              "label": "English Composition and Research ",
              "id": "2-0-1-1",
              "courses": [
                {
                  "Subj": "ENG",
                  "Num": "1213"
                },
                {
                  "Subj": "ENG",
                  "Num": "1223"
                },
                {
                  "Subj": "ENG",
                  "Num": "1233"
                },
                {
                  "Subj": "ENG",
                  "Num": "1243"
                },
                {
                  "Subj": "@",
                  "Num": "@",
                  "With": {
                    "ATTRIBUTE": "ZRSH"
                  },
                  "Hide": 1
                }
              ],
              "reqType": "Credits",
              "reqCount": 3.0,
              "Conn": "Or"
            },
            {
              "label": "Oral Communication ",
              "id": "2-0-1-2",
              "courses": [
                {
                  "Subj": "MCOM",
                  "Num": "1113"
                },
                {
                  "Subj": "@",
                  "Num": "@",
                  "With": {
                    "ATTRIBUTE": "ZCOM"
                  },
                  "Hide": 1
                }
              ],
              "reqType": "Course",
              "reqCount": 1.0,
              "Conn": "Or",
              "except": [
                "ENG 1113",
                "ENG 1213"
              ]
            }
          ],
          "label": "WRITTEN AND ORAL COMMUNICATION "
        },
        {
          "rules": [
            {
              "label": "Math Requirement",
              "id": "3-0-0",
              "courses": [
                {
                  "Subj": "MATH",
                  "Num": "1113"
                },
                {
                  "Subj": "MATH",
                  "Num": "1513"
                },
                {
                  "Subj": "MATH",
                  "Num": "1453"
                },
                {
                  "Subj": "MATH",
                  "Num": "1533"
                },
                {
                  "Subj": "MATH",
                  "Num": "1593"
                },
                {
                  "Subj": "MATH",
                  "Num": "2013"
                },
                {
                  "Subj": "MATH",
                  "Num": "2023"
                },
                {
                  "Subj": "MATH",
                  "Num": "2053"
                },
                {
                  "Subj": "MATH",
                  "Num": "2153"
                },
                {
                  "Subj": "MATH",
                  "Num": "2313"
                },
                {
                  "Subj": "MATH",
                  "Num": "2305"
                },
                {
                  "Subj": "MATH",
                  "Num": "2323",
                  "Hide": 1
                },
                {
                  "Subj": "STAT",
                  "Num": "2103"
                },
                {
                  "Subj": "STAT",
                  "Num": "2113"
                },
                {
                  "Subj": "@",
                  "Num": "@",
                  "With": {
                    "ATTRIBUTE": "ZMTH"
                  },
                  "Hide": 1
                }
              ],
              "reqType": "Credits",
              "reqCount": 3.0,
              "Conn": "Or"
            },
            {
              "label": "Life Science",
              "id": "3-0-1",
              "courses": [
                {
                  "Subj": "BIO",
                  "Num": "1114"
                },
                {
                  "Subj": "BIO",
                  "Num": "1204"
                },
                {
                  "Subj": "BIO",
                  "Num": "1211"
                },
                {
                  "Subj": "BIO",
                  "Num": "1214"
                },
                {
                  "Subj": "BIO",
                  "Num": "1234"
                },
                {
                  "Subj": "@",
                  "Num": "@",
                  "With": {
                    "ATTRIBUTE": "ZLIF"
                  },
                  "Hide": 1
                }
              ],
              "reqType": "Credits",
              "reqCount": 3.0,
              "Conn": "Or"
            },
            {
              "label": "Physical Science",
              "id": "3-0-2",
              "courses": [
                {
                  "Subj": "CHEM",
                  "Num": "1003"
                },
                {
                  "Subj": "CHEM",
                  "Num": "1014"
                },
                {
                  "Subj": "CHEM",
                  "Num": "1103"
                },
                {
                  "Subj": "CHEM",
                  "Num": "1112"
                },
                {
                  "Subj": "PHY",
                  "Num": "1003"
                },
                {
                  "Subj": "PHY",
                  "Num": "1011"
                },
                {
                  "Subj": "PHY",
                  "Num": "1014"
                },
                {
                  "Subj": "PHY",
                  "Num": "1024"
                },
                {
                  "Subj": "PHY",
                  "Num": "1101"
                },
                {
                  "Subj": "PHY",
                  "Num": "1114"
                },
                {
                  "Subj": "PHY",
                  "Num": "1304"
                },
                {
                  "Subj": "PHY",
                  "Num": "2014"
                },
                {
                  "Subj": "@",
                  "Num": "@",
                  "With": {
                    "ATTRIBUTE": "ZPHY"
                  },
                  "Hide": 1
                }
              ],
              "reqType": "Credits",
              "reqCount": 3.0,
              "Conn": "Or"
            },
            {
              "label": "One class with Lab",
              "id": "3-0-3",
              "courses": [
                {
                  "Subj": "BIO",
                  "Num": "1211"
                },
                {
                  "Subj": "BIO",
                  "Num": "1214"
                },
                {
                  "Subj": "CHEM",
                  "Num": "1014"
                },
                {
                  "Subj": "CHEM",
                  "Num": "1112"
                },
                {
                  "Subj": "PHY",
                  "Num": "1024"
                },
                {
                  "Subj": "PHY",
                  "Num": "1011"
                },
                {
                  "Subj": "PHY",
                  "Num": "1101"
                },
                {
                  "Subj": "PHY",
                  "Num": "1114"
                },
                {
                  "Subj": "PHY",
                  "Num": "2014"
                },
                {
                  "Subj": "@",
                  "Num": "@",
                  "With": {
                    "DWTRANSFER": "Y"
                  },
                  "Hide": 1
                }
              ],
              "reqType": "Course",
              "reqCount": 1.0,
              "Conn": "Or"
            }
          ],
          "label": "QUANTITATIVE REASONING/SCIENTIFIC METHOD"
        },
        {
          "rules": [
            {
              "label": "Aesthetic Analysis",
              "id": "4-0-0",
              "courses": [
                {
                  "Subj": "HUM",
                  "Num": "2113"
                },
                {
                  "Subj": "HUM",
                  "Num": "2223"
                },
                {
                  "Subj": "@",
                  "Num": "@",
                  "With": {
                    "ATTRIBUTE": "ZAES"
                  },
                  "Hide": 1
                }
              ],
              "reqType": "Credits",
              "reqCount": 3.0,
              "Conn": "Or"
            },
            {
              "label": "Critical Inquiry",
              "id": "4-0-1",
              "courses": [
                {
                  "Subj": "PHIL",
                  "Num": "1103"
                },
                {
                  "Subj": "PHIL",